Post_ID,Title,Text,Author,Upvotes,Comments,Timestamp,URL,Sentiment,Risk_Level,Extracted_Location
1js45dp,SSRIs reality support and how to beat anxiety.,"I remember when I started taking the medication — I was only 17, dealing with anxiety and OCD. Like everyone else, I just wanted to feel ‘normal’ again, to feel like I did before, but that never really happened… until I started taking escitalopram.

The first two weeks were intense, but then I started feeling better — a bit of peace in my head. In the end, I was just a scared kid who wanted to feel okay. After a few months, things improved, and I started feeling normal. I felt calm and good, but also a bit numb and unmotivated, which is a side effect of the medication. You don’t feel bad, but you don’t feel great either — it dulls your emotions. But I didn’t care, I kept going.

Eventually, I reached a point where I thought I didn’t need it anymore, so I started tapering off. I stopped abruptly because I felt fine and wanted to feel that way without the pill. At first, I still felt okay — but no one had warned me about the withdrawal syndrome. Not even the doctor. That’s when I realized it had just been a patch for the anxiety, not a cure, and I started to understand things more clearly. Withdrawal syndrome usually causes a lot of anxiety and other symptoms. And for you that are here trying to try medication or that is passing the withdrawal symptoms. The problem is the doubt — not knowing whether it’s that or something else — may have affected. I recommend, as someone who has taken this pill, that you stop taking it and be strong. If millions have done it… you can too. Remember that pharmaceutical companies just want more money and to keep people medicated. It’s important that you understand this is just anxiety — which you already had even before taking the antidepressant. (Sorry for my English I speak Spanish)

There are people who are genuinely helped by it, no doubt, but they are much less than half, and that’s often because of the placebo effect. Doctors will tell you, “Yes, it’s definitely good to take medication, it’s a chemical imbalance in the brain,” but that’s not true! It’s really your overactive nervous system keeping you in fight-or-flight mode — as if there’s a lion in front of you that doesn’t exist, and your mind is trying to protect you from it. I recommend exercising, even if it’s hard. Stop searching on Reddit or Google. I’m here too because I’m also tapering off the medication, and I like to see how others are going through this hard time. But I’ve realized something: everyone seems to go through it in a similar way, and yet each of us has the ability to educate ourselves and face our own mind. It’s crucial to understand that this is temporary and requires a lot of patience, and to not stop doing what you truly want to do — as long as it’s something positive.

Ask any psychiatrist or psychologist if they’ve ever cured a patient, and most likely they won’t know how to answer — because anxiety, OCD, and depression aren’t cured with pills. Medication treats the symptoms, not the cause. And if there’s no apparent cause, it’s probably your thoughts — the ones you give too much value and importance to.

I’ll never forget the time I thought, “What if I hurt someone I love?” (an OCD thought). That mental trap — validating whether I was really capable of doing that — terrified me, and I started avoiding the thoughts. But that’s the real problem: avoiding them because of that mental trap. And believe it or not, everyone has those thoughts — they just don’t give them importance.

In the end, it’s all up to you — not a pill or a therapist. It sounds rough, but it’s possible. Instead of reading things on Reddit, look for stories of how people recovered from anxiety and how they faced it. Those Reddit posts are often written by people lying in bed, full of anxiety, doing nothing to get out of it — just waiting for the medicine to kick in or for something to magically change, but that doesn’t work. What works is being active, doing things you know are good for you — over and over again. It’s like taking your brain to the gym. You have to train it, and it’s rare to see immediate results at first. It takes time. The best thing is to accept where you are, stop fighting your mind (because that only makes it worse), and understand it. Understand that it’s just on high alert — and just like you entered this, you can get out of it.

I love you because I understand you, and we’re all going to get through this. ALL of us. God bless you.”",Beautiful_Opening_11,2,2,1743861771.0,https://www.reddit.com/r/Anxiety/comments/1js45dp/ssris_reality_support_and_how_to_beat_anxiety/,Positive,Moderate Concern,Reddit
